1,1,D,SiteOnWhelsA,Channel A ,Interop ,Colorado Mutual Aid - SOW ,2
2,2,D,SiteOnWhelsB,Channel B ,Interop ,Colorado Mutual Aid - SOW ,2
3,3,D,SiteOnWhelsC,Channel C ,Interop ,Colorado Mutual Aid - SOW ,2
4,4,D,SiteOnWhelsD,Channel D ,Interop ,Colorado Mutual Aid - SOW ,2
5,5,D,SiteOnWhelsE,Channel E ,Interop ,Colorado Mutual Aid - SOW ,2
6,6,D,SiteOnWhelsF,Channel F ,Interop ,Colorado Mutual Aid - SOW ,2
7,7,D,SiteOnWhelsG,Channel G ,Interop ,Colorado Mutual Aid - SOW ,2
8,8,D,SiteOnWhelsH,Channel H ,Interop ,Colorado Mutual Aid - SOW ,2
9,9,D,SiteOnWhelsI,Channel I ,Interop ,Colorado Mutual Aid - SOW ,2
10,00a,D,SiteOnWhelsJ,Channel J ,Interop ,Colorado Mutual Aid - SOW ,2
11,00b,D,SiteOnWhelsK,Channel K ,Interop ,Colorado Mutual Aid - SOW ,2
12,00c,D,SiteOnWhelsL,Channel L ,Interop ,Colorado Mutual Aid - SOW ,2
13,00d,D,SiteOnWhelsM,Channel M ,Interop ,Colorado Mutual Aid - SOW ,2
14,00e,D,SiteOnWhelsN,Channel N ,Interop ,Colorado Mutual Aid - SOW ,2
15,00f,D,SiteOnWhelsO,Channel O ,Interop ,Colorado Mutual Aid - SOW ,2
16,10,D,SiteOnWlsATG,Announcement Talk Group ,Interop ,Colorado Mutual Aid - SOW ,2
39,27,D,EMetCom Disp,East MetCom Dispatch ,Fire Dispatch ,Arapahoe County ,2
40,28,D,EMetCom Ops1,East MetCom Ops 1 ,Fire-Tac ,Arapahoe County ,2
41,29,D,EMetCom Trn2,East MetCom Training 2 ,Fire-Talk ,Arapahoe County ,2
42,02a,D,EMetCom Admn,East MetCom Admin ,Fire-Talk ,Arapahoe County ,2
44,02c,D,LasAnimsLaw1,Trinidad Police & Las Animas County Sheriff Dispatch ,Law Dispatch ,Las Animas County ,2
45,02d,D,LasAnimsLaw2,Trinidad Police & Las Animas County Sheriff Tactical ,Law Tac ,Las Animas County ,2
46,02e,D,TrinidadCty1,Trinidad City Services Channel-1 ,Law Tac ,Las Animas County ,2
47,02f,D,TrinidadFD,Trinidad Fire Dispatch ,Fire Dispatch ,Las Animas County ,2
48,30,D,TrnidadFDTac,Trinidad Fire Tactical ,Fire-Tac ,Las Animas County ,2
49,31,D,TrinidadCty2,Trinidad City Services Channel-2 ,Public Works ,Las Animas County ,2
50,32,D,TrinidadLcGv,Trinidad Local Government ,Public Works ,Las Animas County ,2
51,33,D,LsAnmsLawTac,Las Animas County Law Enforcement Tactical ,Law Tac ,Las Animas County ,2
52,34,D,TrinidadR&B,Trinidad Road & Bridge ,Public Works ,Las Animas County ,2
53,35,D,Adams Co MAC,County Mutual Aid Channel ,Interop ,Adams County ,2
63,03f,D,LafyeteFDFG2,Lafayette Fire Fireground 2 ,Fire-Tac ,Boulder County ,2
64,40,D,LafyeteFDFG1,Lafayette Fire Fireground 1 ,Fire-Tac ,Boulder County ,2
66,42,D,AVISTA,Avista Adventist Hospital ,Hospital ,Colorado Hospitals ,2
67,43,D,BLDRCOMMHSP,Boulder Community Hospital ,Hospital ,Colorado Hospitals ,2
68,44,D,CENTHEALTH,Centennial Health Care ,Hospital ,Colorado Hospitals ,2
69,45,D,CHILDRENS,Children's Hospital of Denver ,Hospital ,Colorado Hospitals ,2
70,46,D,DEN HEALTH,Denver Health ,Hospital ,Colorado Hospitals ,2
71,47,D,LITTLETNHSP,Littleton Adventist Hospital ,Hospital ,Colorado Hospitals ,2
72,48,D,LONGMNT HSP,Longmont United Hospital ,Hospital ,Colorado Hospitals ,2
73,49,D,LUTH HOSP,Exempla Lutheran Medical Center ,Hospital ,Colorado Hospitals ,2
74,04a,D,AUR MED CTR,Medical Center of Aurora ,Hospital ,Colorado Hospitals ,2
75,04b,D,NRTHSUB MED,North Suburban ,Hospital ,Colorado Hospitals ,2
76,04c,D,PLT VAL MED,Platte Valley Medical Center ,Hospital ,Colorado Hospitals ,2
77,04d,D,PORTER HSP,Porter Adventist Hospital ,Hospital ,Colorado Hospitals ,2
78,04e,D,PSL HOSP,Presbyterian / St. Luke's Medical Center ,Hospital ,Colorado Hospitals ,2
79,04f,D,ARK VAL HSP,Arkansas Valley Medical Center ,Hospital ,Colorado Hospitals ,2
80,50,D,ROSE MED CR,Rose Medical Center ,Hospital ,Colorado Hospitals ,2
81,51,D,ST ANTH CEN,St. Anthony's Central Communications Center ,Hospital ,Colorado Hospitals ,2
82,52,D,STANTH NRTH,St. Anthony's North ,Hospital ,Colorado Hospitals ,2
83,53,D,ST JOE HOSP,St. Joseph's Hospital ,Hospital ,Colorado Hospitals ,2
84,54,D,SWEDISH MED,Swedish Medical Center ,Hospital ,Colorado Hospitals ,2
85,55,D,UNIV MED CT,University of Colorado Hospital ,Hospital ,Colorado Hospitals ,2
86,56,D,SKYRIDGE,Sky Ridge Medical Center ,Hospital ,Colorado Hospitals ,2
87,57,D,CENT PKR H,Centura Parker ,Hospital ,Colorado Hospitals ,2
88,58,D,SWEDISH SW,Swedish Southwest Emergency Department ,Hospital ,Colorado Hospitals ,2
90,05a,D,La Junta PD,La Junta Police Department Dispatch ,Law Dispatch ,Otero County ,2
91,05b,D,LaJuntaPDTac,La Junta Police Department Tactical ,Law Tac ,Otero County ,2
92,05c,D,La Junta FD,La Junta Fire Department Dispatch ,Fire Dispatch ,Otero County ,2
93,05d,D,LaJuntaFD FG,La Junta Fire Department Fireground ,Fire-Tac ,Otero County ,2
94,05e,D,LaJuntaLcGv1,La Junta Local Government ,Public Works ,Otero County ,2
95,05f,D,LaJuntaLcGv2,La Junta Local Government ,Public Works ,Otero County ,2
96,60,D,OteroCoSO,Otero County Sheriff Dispatch ,Law Dispatch ,Otero County ,2
97,61,D,RockyFordPD,Rocky Ford Police Department Dispatch ,Law Dispatch ,Otero County ,2
100,64,D,PDR SD N BUS,Poudre School District North Bus Terminal ,Schools ,Larimer County ,2
101,65,D,PDR SD S BUS,Poudre School District South Bus Terminal ,Schools ,Larimer County ,2
102,66,D,PDR SD TRANS,Poudre School District Transportation ,Schools ,Larimer County ,2
103,67,D,PDR SD GRNDS,Poudre School District Grounds ,Schools ,Larimer County ,2
104,68,D,PDR SD INFSY,Poudre School District Information Systems ,Schools ,Larimer County ,2
105,69,D,PDR SCHOOLS,Poudre School District ,Schools ,Larimer County ,2
106,06a,D,PDR SD EMERG,Poudre School District Emergency/Security ,Schools ,Larimer County ,2
108,06c,D,BLDR FT HSP,Boulder Community / Foothills Hospital ,Hospital ,Colorado Hospitals ,2
109,06d,D,CDR SPG HTH,Cedar Springs Behavioral Health System ,Hospital ,Colorado Hospitals ,2
110,06e,D,CEN PK HSP,Centennial Peaks Health ,Hospital ,Colorado Hospitals ,2
111,06f,D,PENROSE HSP,Penrose / St. Francis Health ,Hospital ,Colorado Hospitals ,2
112,70,D,ST MARY HSP,St. Mary Corwin Medical ,Hospital ,Colorado Hospitals ,2
113,71,D,ST THOMAS,St. Thomas Moore Hospital ,Hospital ,Colorado Hospitals ,2
114,72,D,COMHI LOGAN,Colorado Mental Health Ft. Logan ,Hospital ,Colorado Hospitals ,2
115,73,D,COMHI PUBLO,Colorado Mental Health Pueblo ,Hospital ,Colorado Hospitals ,2
116,74,D,COMHI FRNSC,Colorado Mental Health Pueblo Forensic ,Hospital ,Colorado Hospitals ,2
117,75,D,CO PLAINS,Colorado Plains Medical Center ,Hospital ,Colorado Hospitals ,2
118,76,D,CRAIG HSP,Craig Hospital ,Hospital ,Colorado Hospitals ,2
119,77,D,DEVEREUX,Cleo Wallace ,Hospital ,Colorado Hospitals ,2
120,78,D,EMORGAN HSP,East Morgan County Hospital ,Hospital ,Colorado Hospitals ,2
121,79,D,Estes Pk MD,Estes Park Medical Center EMS ,Hospital ,Larimer County ,2
122,07a,D,HAXTUN HSP,Haxtun Hospital District ,Hospital ,Colorado Hospitals ,2
123,07b,D,HTHHSP CSPG,Health South of Colorado Springs ,Hospital ,Colorado Hospitals ,2
124,07c,D,HEART MED,Heart of the Rockies Medical Center ,Hospital ,Colorado Hospitals ,2
125,07d,D,KEEFE HOSP,Keefe Memorial Hospital ,Hospital ,Colorado Hospitals ,2
126,07e,D,KINDRED HSP,Kindred Hospital Denver ,Hospital ,Colorado Hospitals ,2
127,07f,D,KTCARSN HSP,Kit Carson Community Medical Center ,Hospital ,Colorado Hospitals ,2
128,80,D,LFECARE DEN,Life Care Hospitals of Denver ,Hospital ,Colorado Hospitals ,2
129,81,D,LINCOLN HSP,Lincoln Community Hospital ,Hospital ,Colorado Hospitals ,2
130,82,D,MELISSA HSP,Melissa Medical Center ,Hospital ,Colorado Hospitals ,2
131,83,D,MEM HLTHSYS,Memorial Hospital Colorado Springs ,Hospital ,Colorado Hospitals ,2
132,84,D,MTSANRAFEL,Mt. San Rafael Hospital ,Hospital ,Colorado Hospitals ,2
133,85,D,NAT JEWISH,Nat'l Jewish Medical Research Center ,Hospital ,Colorado Hospitals ,2
134,86,D,NVALLY REHB,North Valley Rehab Hospital ,Hospital ,Colorado Hospitals ,2
135,87,D,NVALLY PSYC,North Valley Rehab Hospital - Phyc ,Hospital ,Colorado Hospitals ,2
136,88,D,PARKVIEW MD,Parkview Medical Center ,Hospital ,Colorado Hospitals ,2
137,89,D,PROWERS MED,Prowers Medical Center ,Hospital ,Colorado Hospitals ,2
138,08a,D,TRIUMPH AU,SCCI Aurora ,Hospital ,Colorado Hospitals ,2
139,08b,D,SEDWICK HSP,Sedgwick Memorial Hospital ,Hospital ,Colorado Hospitals ,2
140,08c,D,SLCT HSP DN,Select Specialty Denver ,Hospital ,Colorado Hospitals ,2
141,08d,D,SLCT HSP DS,Select Specialty Denver South ,Hospital ,Colorado Hospitals ,2
142,08e,D,SMPR HSP CS,Sempercare Colorado Springs ,Hospital ,Colorado Hospitals ,2
143,08f,D,SECOSPG HSP,Southeast Colorado Hospital ,Hospital ,Colorado Hospitals ,2
144,90,D,PRES REHAB,Spalding Rehab Center at St. Luke's ,Hospital ,Colorado Hospitals ,2
145,91,D,ROSE REHAB,Spalding Rehab Center at Rose Hospital ,Hospital ,Colorado Hospitals ,2
146,92,D,SPALD REHAB,Spalding Rehab Center ,Hospital ,Colorado Hospitals ,2
147,93,D,SPAN PK HSP,Spanish Peaks Regional Medical Center ,Hospital ,Colorado Hospitals ,2
148,94,D,STERLING HSP,Sterling Regional Medical Center ,Hospital ,Colorado Hospitals ,2
149,95,D,VA HOSP DEN,Veterans Affairs (VA) Hospital - Denver ,Hospital ,Colorado Hospitals ,2
150,96,D,WEISBRD HSP,Weisbrod Memorial Hospital ,Hospital ,Colorado Hospitals ,2
151,97,D,WRAY HOSP,Wray Community Hospital ,Hospital ,Colorado Hospitals ,2
152,98,D,YUMA HOSP,Yuma Hospital ,Hospital ,Colorado Hospitals ,2
153,99,D,ANSHUTZ HSP,Anschutz Hospital of Aurora Security ,Security ,Colorado Hospitals ,2
154,09a,D,KSR PRMT HSP,Kaiser Permanente Hospital ,Hospital ,Colorado Hospitals ,2
155,09b,D,COCommHlth1,Community Health Network 1 ,Hospital ,Colorado Department of Public Health and Environment ,2
156,09c,D,Tier 1 Train,Tier One Emergency Training and Response ,Other ,Miscellaneous Talkgroups ,2
157,09d,D,ColoOrthoSA,Colorado Ortho Hospital at St. Anthony's ,Hospital ,Colorado Hospitals ,2
158,09e,D,CRAdvtstHsp,Castle Rock Adventist Hospital ,Hospital ,Colorado Hospitals ,2
162,0a2,D,EMS MH,Mile-High RETAC Coordinator ,Hospital ,Colorado Hospitals ,2
163,0a3,D,EMS NE,Northeastern Colorado RETAC Coordinator ,Hospital ,Colorado Hospitals ,2
164,0a4,D,EMS PP,Plains to Peaks RETAC Coordinator ,Hospital ,Colorado Hospitals ,2
165,0a5,D,EMS SE,Southeast Colorado RETAC Coordinator ,Hospital ,Colorado Hospitals ,2
166,0a6,D,EMS S,Southern Colorado RETAC Coordinator ,Hospital ,Colorado Hospitals ,2
167,0a7,D,EMS FH,Foothills RETAC Coordinator ,Hospital ,Colorado Hospitals ,2
168,0a8,D,EMS MAC,Statewide EMS Mutual Aid ,Interop ,Colorado Mutual Aid ,2
169,0a9,D,PublicHlthNE,Public Health Northeast ,Hospital ,Colorado Department of Public Health and Environment ,2
170,0aa,D,PublicHlthNC,Public Health Northcentral ,Hospital ,Colorado Department of Public Health and Environment ,2
171,0ab,D,PublicHlthSC,Public Health Southcentral ,Hospital ,Colorado Department of Public Health and Environment ,2
172,0ac,D,PublicHlthS,Public Health South ,Hospital ,Colorado Department of Public Health and Environment ,2
173,0ad,D,PublicHlthSE,Public Health Southeast ,Hospital ,Colorado Department of Public Health and Environment ,2
174,0ae,D,PP RG MD CTR,Pikes Peak Regional Medical Center ,Hospital ,Colorado Hospitals ,2
175,0af,D,NParkMedCtr,North Park Medical Center ,Hospital ,Colorado Hospitals ,2
176,0b0,D,SpldgRhbHsp,Spalding Rehabilitation Hospital ,Hospital ,Colorado Hospitals ,2
201,0c9,D,OteroCoSOTac,Otero County Sheriff Tactical ,Law Tac ,Otero County ,2
202,0ca,D,RckyFrdPDTac,Rocky Ford Police Department Tactical ,Law Tac ,Otero County ,2
203,0cb,D,Bent Co SO,Bent County Sheriff (includes Kiowa County) ,Law Dispatch ,Bent County ,2
204,0cc,DE,BentCoSOTac,Bent County Sheriff Tactical ,Law Tac ,Bent County ,2
205,0cd,D,CrowleyCoSO,Crowley County Sheriff Dispatch ,Law Dispatch ,Crowley County ,2
206,0ce,D,CrowleySOTac,Crowley County Sheriff Tactical ,Law Tac ,Crowley County ,2
207,0cf,D,LasAnimasPD,Las Animas Police Department ,Law Dispatch ,Bent County ,2
208,0d0,D,LsAnmsPDTac,Las Animas Police Department Tactical ,Law Tac ,Bent County ,2
209,0d1,DE,KiowaCoSO,Kiowa County Sheriff Dispatch ,Law Dispatch ,Kiowa County ,2
210,0d2,DE,KiowaSOTac,Kiowa County Sheriff Tactical ,Law Tac ,Kiowa County ,2
211,0d3,D,ProwersCoSO,Prowers County Sheriff Dispatch ,Law Dispatch ,Prowers County ,2
212,0d4,D,ProwersSOTac,Prowers County Sheriff Tactical ,Law Tac ,Prowers County ,2
213,0d5,D,RckyFrdFDTac,Rocky Ford Fire Department Tactical ,Fire-Tac ,Otero County ,2
214,0d6,D,LasAnimasFD,Las Animas Fire/EMS ,Fire Dispatch ,Bent County ,2
215,0d7,D,LsAnmsFDTac,Las Animas Fire/EMS Tactical ,Fire-Tac ,Bent County ,2
216,0d8,D,RockyFordFD,Rocky Ford Fire Department Dispatch ,Fire Dispatch ,Otero County ,2
217,0d9,D,Fowler PD,Fowler Police Department Dispatch ,Law Dispatch ,Otero County ,2
218,0da,D,OEM SC,South Central All-Hazards Region ,Emergency Ops ,Colorado Division of Homeland Security & Emergency Management ,2
219,0db,D,OEM SE,Southeast All-Hazards Region ,Emergency Ops ,Colorado Division of Homeland Security & Emergency Management ,2
220,0dc,D,OEM S,South All-Hazards Region ,Emergency Ops ,Colorado Division of Homeland Security & Emergency Management ,2
221,0dd,D,FowlerPDTac,Fowler Police Department Tactical ,Law Tac ,Otero County ,2
222,0de,D,Fowler EMS,Fowler EMS Dispatch ,EMS Dispatch ,Otero County ,2
223,0df,D,FowlerFDTac,Fowler Fire Department Tactical ,Fire-Tac ,Otero County ,2
224,0.00E+00,D,FowlerLocGov,Fowler Local Government ,Public Works ,Otero County ,2
225,0.00E+00,D,ManznlaLocGv,Manzanola Local Government ,Public Works ,Otero County ,2
226,0.00E+00,D,OteroCoMAC,Otero County Mutual Aid Channel ,Interop ,Otero County ,2
227,0.00E+00,D,LaJuntaTrnst,La Junta City Transit ,Transportation ,Otero County ,2
228,0.00E+00,D,RckyFrdLcGv1,Rocky Ford Local Government Channel-1 ,Public Works ,Otero County ,2
229,0.00E+00,D,RckyFrdLcGv2,Rocky Ford Local Government Channel-2 ,Public Works ,Otero County ,2
230,0.00E+00,D,OteroCoR&B,Otero County Road & Bridge ,Public Works ,Otero County ,2
231,0.00E+00,D,EOtroSchBus,East Otero County School District R1 - Buses ,Schools ,Otero County ,2
232,0.00E+00,D,EotroSchAdm,East Otero County School District R1 - Administration ,Schools ,Otero County ,2
233,0.00E+00,D,Cheraw FD,Cheraw Fire Department Dispatch ,Fire Dispatch ,Otero County ,2
269,10d,D,Hsty/McClvFD,Hasty/McClave Fire Departments ,Fire Dispatch ,Bent County ,2
270,10e,D,Hst/MCFDTac,Hasty/McClave Fire Departments Tactical ,Fire-Tac ,Bent County ,2
271,10f,D,Bent Co R&B,Bent County Road & Bridge ,Public Works ,Bent County ,2
272,110,D,LasAnimasLG1,Las Animas Local Government Channel-1 ,Law Dispatch ,Bent County ,2
273,111,D,Bent Co MAC,Bent County Mutual Aid Channel ,Interop ,Bent County ,2
274,112,DE,Bent Co Law,Bent County Law Enforcement ,Law Dispatch ,Bent County ,2
294,126,D,ProwersCoMAC,Prowers County Mutual Aid Channel ,Interop ,Prowers County ,2
295,127,DE,Lamar PD,Lamar Police Department ,Law Dispatch ,Prowers County ,2
296,128,D,LamarPDTac,Lamar Police Department Tactical ,Law Tac ,Prowers County ,2
297,129,D,LamarFD/EMS,Lamar Fire Department/EMS ,Fire Dispatch ,Prowers County ,2
298,12a,D,LamarFDTac,Lamar Fire Department Tactical ,Fire-Tac ,Prowers County ,2
299,12b,D,LamarLocGov1,Lamar Local Government Channel-1 ,Public Works ,Prowers County ,2
300,12c,D,LamarLocGOv2,Lamar Local Government Channel-2 ,Public Works ,Prowers County ,2
301,12d,D,ProwersCoR&B,Prowers County Road & Bridge ,Public Works ,Prowers County ,2
302,12e,D,Holly EMS,Holly EMS ,EMS Dispatch ,Prowers County ,2
303,12f,D,ProwersCoFD2,Prowers County Rural Fire Departments Channel-2 ,Fire-Tac ,Prowers County ,2
304,130,D,ProwersCoFD3,Prowers County Rural Fire Departments Channel-3 ,Fire-Tac ,Prowers County ,2
305,131,D,Wiley Fire,Wiley Fire Department ,Fire Dispatch ,Prowers County ,2
306,132,D,WileyFDTac,Wiley Fire Department Tactical ,Fire-Tac ,Prowers County ,2
317,13d,D,KiowaCoFire,Kiowa County Fire Departments ,Fire Dispatch ,Kiowa County ,2
318,13e,D,KiowaCoEMS,Kiowa County EMS ,EMS Dispatch ,Kiowa County ,2
319,13f,D,KiowaCoMAC,Kiowa County Mutual Aid Channel ,Interop ,Kiowa County ,2
320,140,D,KiowaCoR&B,Kiowa County Road & Bridge ,Public Works ,Kiowa County ,2
321,141,D,EadsLocGov,City of Eads Local Government ,Public Works ,Kiowa County ,2
344,158,D,Baca Co Law1,Baca County Law Enforcement Dispatch ,Law Dispatch ,Baca County ,2
345,159,D,Baca Co Law2,Baca County Law Enforcement Channel-2 ,Law Tac ,Baca County ,2
346,15a,D,Baca Co Law3,Baca County Law Enforcement Channel-3 ,Law Tac ,Baca County ,2
347,15b,D,SprngfldPD2,Springfield Police Department Channel-2 ,Law Tac ,Baca County ,2
348,15c,D,BacaCoR&B1,Baca County Road and Bridge District-1 ,Public Works ,Baca County ,2
349,15d,D,Baca Co MAC,Baca County Mutual Aid Channel ,Interop ,Baca County ,2
350,15e,D,SpgfldLocGov,Springfield Local Government ,Public Works ,Baca County ,2
351,15f,D,Sprngfld FD,Springfield Fire Department ,Fire Dispatch ,Baca County ,2
352,160,D,Campo FD,Campo Fire Department ,Fire Dispatch ,Baca County ,2
353,161,D,Walsh FD/EMS,Walsh Fire/EMS ,Fire Dispatch ,Baca County ,2
354,162,D,Sprngfld EMS,Springfield EMS ,EMS Dispatch ,Baca County ,2
355,163,D,Baca Co Ops1,Baca County Operations Channel-1 ,Public Works ,Baca County ,2
356,164,D,BacaCoR&B2,Baca County Road and Bridge District-2 ,Public Works ,Baca County ,2
357,165,D,BacaCoR&B3,Baca County Road and Bridge District-3 ,Public Works ,Baca County ,2
358,166,D,BacaCoComsnr,Baca County Commissioners ,Public Works ,Baca County ,2
359,167,D,PritchettFD,Pritchett Fire Department ,Fire Dispatch ,Baca County ,2
360,168,D,Vilas FD,Vilas Fire Department ,Fire Dispatch ,Baca County ,2
361,169,D,TwoButtesFPD,Two Buttes Fire Protection District ,Fire Dispatch ,Baca County ,2
362,16a,D,Baca Co Ops2,Baca County Operations Channel-2 ,Public Works ,Baca County ,2
369,171,D,CrowleyCoR&B,Crowley County Road & Bridge ,Public Works ,Crowley County ,2
370,172,D,CrowleyCoMAC,Crowley County Mutual Aid Channel ,Interop ,Crowley County ,2
371,173,D,CrowleyCoFD1,Crowley County Fire Departments Channel-1 ,Fire Dispatch ,Crowley County ,2
372,174,D,CrowleyCoFD2,Crowley County Fire Departments Channel-2 ,Fire-Tac ,Crowley County ,2
373,175,D,CrowleyCoFD3,Crowley County Fire Departments Channel-3 ,Fire-Tac ,Crowley County ,2
374,176,D,CrowleyEMS1,Crowley County EMS Channel-1 ,EMS Dispatch ,Crowley County ,2
375,177,D,CrowleyEMS2,Crowley County EMS Channel-2 ,EMS-Tac ,Crowley County ,2
376,178,D,OrdwayLocGov,Ordway Local Government ,Public Works ,Crowley County ,2
394,18a,D,CheynneCoMAC,Cheyenne County Mutual Aid Channel ,Interop ,Cheyenne County ,2
395,18b,D,ChynneCoLaw1,Cheyenne County Law Enforcement Channel-1 ,Law Dispatch ,Cheyenne County ,2
396,18c,D,ChynneCoLaw2,Cheyenne County Law Enforcement Channel-2 ,Law Tac ,Cheyenne County ,2
397,18d,D,ChynneCoEMS1,Cheyenne County EMS Channel-1 ,EMS Dispatch ,Cheyenne County ,2
398,18e,D,ChynneCoEMS2,Cheyenne County EMS Channel-2 ,EMS-Talk ,Cheyenne County ,2
399,18f,D,ChynneCoFD1,Cheyenne County Fire Departments Channel-1 ,Fire Dispatch ,Cheyenne County ,2
400,190,D,ChynneCoFD2,Cheyenne County Fire Departments Channel-2 ,Fire-Tac ,Cheyenne County ,2
401,191,D,ChynCoCorner,Cheyenne County Coroner Channel-1 ,Law Talk ,Cheyenne County ,2
402,192,D,ChynCoHazmat,Cheyenne County HAZMAT Channel-1 ,Fire-Tac ,Cheyenne County ,2
403,193,D,CheyennCoPW1,Cheyenne County Public Works Channel-1 ,Public Works ,Cheyenne County ,2
404,194,D,CheyennCoPW2,Cheyenne County Public Works Channel-2 ,Public Works ,Cheyenne County ,2
405,195,D,ChynCoHealth,Cheyenne County Health Department Channel-1 ,EMS-Talk ,Cheyenne County ,2
419,1a3,D,KitCarsonMAC,Kit Carson County Mutual Aid Channel ,Interop ,Kit Carson County ,2
420,1a4,D,KitCarsnLaw1,Kit Carson County Law Enforcement Channel-1 ,Law Dispatch ,Kit Carson County ,2
421,1a5,D,KitCarsnLaw2,Kit Carson County Law Enforcement Channel-2 ,Law Tac ,Kit Carson County ,2
422,1a6,D,KitCarsnEMS1,Kit Carson County EMS Channel-1 ,EMS Dispatch ,Kit Carson County ,2
423,1a7,D,KitCarsnEMS2,Kit Carson County EMS Channel-2 ,EMS-Tac ,Kit Carson County ,2
424,1a8,D,KitCarsonFD1,Kit Carson County Fire Departments Channel-1 ,Fire Dispatch ,Kit Carson County ,2
425,1a9,D,KitCarsonFD2,Kit Carson County Fire Departments Channel-2 ,Fire-Tac ,Kit Carson County ,2
426,1aa,D,KitCarsnCrnr,Kit Carson County Coroner ,Law Talk ,Kit Carson County ,2
427,1ab,D,KitCrsnHazmt,Kit Carson County HAZMAT ,Fire-Tac ,Kit Carson County ,2
428,1ac,D,KitCarsonOEM,Kit Carson County Office of Emergency Management ,Emergency Ops ,Kit Carson County ,2
429,1ad,D,KitCarsonPW1,Kit Carson County Public Works Channel-1 ,Public Works ,Kit Carson County ,2
430,1ae,D,KitCarsonPW2,Kit Carson County Public Works Channel-2 ,Public Works ,Kit Carson County ,2
431,1af,D,KitCarsnHlth,Kit Carson County Health Department ,Hospital ,Kit Carson County ,2
444,1bc,D,CusterCoSO1,Custer County Sheriff Channel-1 Dispatch ,Law Dispatch ,Custer County ,2
445,1bd,D,CusterCoSO2,Custer County Sheriff Channel-2 ,Law Tac ,Custer County ,2
446,1be,D,CusterCoEMS1,Custer County EMS Channel-1 ,EMS Dispatch ,Custer County ,2
447,1bf,D,CusterCoFG,Custer County Fire Fireground ,Fire-Tac ,Custer County ,2
448,1c0,D,CusterCoEMS3,Custer County EMS Channel-3 ,EMS-Tac ,Custer County ,2
449,1c1,D,Wet Mtn Fire,Wet Mountain Fire District ,Fire Dispatch ,Custer County ,2
450,1c2,D,Wetmore Fire,Wetmore Fire District ,Fire Dispatch ,Custer County ,2
451,1c3,D,CusterCoFD3,Custer County Fire Channel-3 ,Fire-Tac ,Custer County ,2
452,1c4,D,CusterCoR&B,Custer County Road & Bridge ,Public Works ,Custer County ,2
453,1c5,D,CusterCoMAC,Custer County Mutual Aid Channel ,Interop ,Custer County ,2
455,1c7,D,CusterCoSD,Custer County School District ,Schools ,Custer County ,2
494,1ee,D,LincolnCoMAC,Lincoln County Mutual Aid Channel ,Interop ,Lincoln County ,2
495,1ef,D,LinclnCoLaw1,Lincoln County Law Enforcement Channel-1 ,Law Dispatch ,Lincoln County ,2
496,1f0,D,LincCoLawTac,Lincoln County Law Enforcement Tactical ,Law Tac ,Lincoln County ,2
497,1f1,D,LincolnCoSO,Lincoln County Sheriff's Department ,Law Tac ,Lincoln County ,2
498,1f2,D,LincolnCoEMS,Lincoln County EMS ,EMS Dispatch ,Lincoln County ,2
499,1f3,D,LincolnCoFD,Lincoln County Fire ,Fire Dispatch ,Lincoln County ,2
500,1f4,D,LincCoFDFg1,Lincoln County Fireground-1 ,Fire-Tac ,Lincoln County ,2
501,1f5,D,LincCoFDFg2,Lincoln County Fireground-2 ,Fire-Tac ,Lincoln County ,2
502,1f6,D,LincCoFDFg3,Lincoln County Fireground-3 ,Fire-Tac ,Lincoln County ,2
503,1f7,D,Hugo PD,Hugo Police Department ,Law Dispatch ,Lincoln County ,2
504,1f8,D,Limon PD,Limon Police Department ,Law Dispatch ,Lincoln County ,2
505,1f9,D,NE C-EM,Northeast Colorado Emergency Managers ,Emergency Ops ,Colorado Division of Homeland Security & Emergency Management ,2
506,1fa,D,LincCoHealth,Lincoln County Public Health ,Hospital ,Lincoln County ,2
507,1fb,D,DglsSOHRTrng,Douglas County Sheriff - Highlands Ranch Law Enforcement Training Facility ,Law Talk ,Douglas County ,2
512,200,D,ElbertCoSO5,Sheriff 5 Talk ,Law Tac ,Elbert County ,2
513,201,D,ElbertCoSO6,Sheriff 6 ,Law Tac ,Elbert County ,2
514,202,D,ElbertCoEmCm,County Emergency Communications ,Emergency Ops ,Elbert County ,2
515,203,D,ElbertFDOps3,County Fire Departments Ops 3 Eastern Ops (Kiowa North Central Agate & Simla) ,Fire-Tac ,Elbert County ,2
516,204,D,ElbertFDOps4,County Fire Departments Ops 4 Eastern Ops (Kiowa North Central Agate & Simla) ,Fire-Tac ,Elbert County ,2
517,205,D,ElbertCoLawT,County Law Tactical ,Law Tac ,Elbert County ,2
518,206,D,ElbertFDAdmn,County Fire Departments Admin ,Fire-Tac ,Elbert County ,2
519,207,D,ElbertFDOps1,County Fire Departments Ops 1 Western Ops (Rattlesnake Elizabeth Elbert) ,Fire-Tac ,Elbert County ,2
520,208,D,ElbertFDOps2,County Fire Departments Ops 2 Western Ops (Rattlesnake Elizabeth Elbert) ,Fire-Tac ,Elbert County ,2
521,209,D,ElbertCoOEM,County Emergency Management ,Emergency Ops ,Elbert County ,2
522,20a,D,ElbertCo DPW,County Road  ,Public Works ,Elbert County ,2
525,20d,D,SimlaFDOps,Simla Fire Ops ,Fire-Tac ,Elbert County ,2
560,230,D,LincCoCornr,Lincoln County Coroner ,Public Works ,Lincoln County ,2
600,258,D,HuerfanoR&B1,Huerfano County Road & Bridge ,Public Works ,Huerfano County ,2
601,259,D,HuerfanoR&B2,Huerfano County Road & Bridge ,Public Works ,Huerfano County ,2
602,25a,D,HuerfnoSOTac,Huerfano County Sheriff Tactical ,Law Tac ,Huerfano County ,2
603,25b,D,HrfnoCoEM,Huerfano County Emergency Management ,Emergency Ops ,Huerfano County ,2
604,25c,D,HrfanoRE1Bus,Huerfano County RE1 Schools - Buses ,Schools ,Huerfano County ,2
605,25d,D,HrfanoRE2Bus,Huerfano County RE2 Schools - Buses ,Schools ,Huerfano County ,2
606,25e,D,HuerfnoFDTac,Huerfano County Fire Departments Tactical ,Fire-Tac ,Huerfano County ,2
995,3.00E+03,D,DglsSchBus1,Douglas County School District Bus Channel-1 (West?) ,Schools ,Douglas County ,2
996,3.00E+04,D,DouglsSchDst,Douglas County School District ,Schools ,Douglas County ,2
997,3.00E+05,D,DglsSchBus2,Douglas County School District Bus Channel-2 (East?) ,Schools ,Douglas County ,2
998,3.00E+06,D,DglsSchBus4,Douglas County School District Bus Channel-4 ,Schools ,Douglas County ,2
